,brand,image,ingredient,name,price,category
336,프라이멀 엘리먼츠,https://contents.lotteon.com/itemimage/LB/PD/10/02/11/93/_3/21/45/LBPD10021193_32145_1.jpg/dims/resizef/554X554,"수크로오스, 글리세린, 정제수, 소듐코코일이세티오네이트, 솔비톨, 프로필렌글라이콜, 다이소듐라우레스설포석시네이트, 향료, 소듐클로라이드, 페녹시에탄올, 테트라소듐이디티에이, 디나토늄벤조에이트",페이셜 슈가휩 스크럽 113g [업체배송],"16,900원",스킨케어
337,유리아쥬,https://contents.lotteon.com/itemimage/LB/PD/10/01/21/64/_1/90/31/LBPD10012164_19031_1.jpg/dims/resizef/554X554,"정제수,온천수,데실글루코사이드,부틸렌글라이콜,소듐코코일글루타메이트,글리세린,소듐메틸코코일타우레이트,코코-글루코사이드,글리세릴올리에이트,폴리쿼터늄-10,에델바이스꽃/잎추출물,락틱애씨드,피이지-40하이드로제네이티드캐스터오일,벤조익애씨드,페녹시에탄올,에탄올,소듐아세테이트,소듐클로라이드,향료 150,000ppm",진피 마일드 폼 150ml,"21,000원",스킨케어
338,폴라초이스,https://contents.lotteon.com/itemimage/LB/PD/10/01/62/48/_2/52/07/LBPD10016248_25207_1.jpg/dims/resizef/554X554,"정제수, 사이클로펜타실록세인(보습), 징크옥사이드(선스크린), 피이지-12다이메티콘(질감향상제), 피이지/피피지-18/18다이메티콘(질감향상제), 라우로일라이신(피부컨디셔닝제), 소듐클로라이드(안정화제), 트라이하이드록시스테아린(질감향상제), 다이메티콘크로스폴리머(현탄제), 레스베라트롤(항산화제), 쿼세틴(항산화제), 에피갈로카테킨갈레이트(항산화제), 토코페릴아세테이트(비타민E/항산화제), 테트라헥실데실아스코베이트(비타민C/항산화제), 아데노신, 비사보롤, 흰버드나무껍질추출물, 석류나무추출물(항산화제), 해마토코쿠스플루비알리스추출물(아스티잔틴/항산화제), 하이드롤라이즈드옥수수전분(질감향상제/매티파잉제), 폴리솔베이트80(질감향상제), 하이드레이티드실리카(질감향상제/매티파잉제), 트라이에톡시카프릴릴실레인(질감향상제), C12-15알킬벤조에이트(질감향상제), 아이소프로필티타늄트라이아이소스테아레이트(질감향상제), 카프릴릴글라이콜(보존제), 헥실렌글라이콜(보존제), 에틸헥실글리세린(보존제), 황색산화철, 적색산화철, 흑색산화철, 페녹시에탄올(보존제)",리지스트 슈퍼-라이트 선크림 SPF30 60ml,"31,200원",스킨케어
339,싸이닉,https://contents.lotteon.com/itemimage/LB/PD/10/02/17/27/_3/28/09/LBPD10021727_32809_1.jpg/dims/resizef/554X554,"포트마리골드꽃추출물, 프로판다이올, 에탄올, 트라이에틸시트레이트, 나이아신아마이드, 1,2-헥산다이올, 정제수, 알란토인, 판테놀, 마데카소사이드, 나일론-12, 폴리메틸실세스퀴옥세인, 라벤더꽃수, 보리지추출물, 수레국화꽃추출물, 마트리카리아꽃/잎추출물, 클레리추출물, 히아신스전초추출물, 접시꽃추출물, 토코페롤, 폴리에스터-5, 카프릴릴글라이콜, 에틸헥실글리세린, 부틸렌글라이콜, 아데노신, 다이포타슘글리시리제이트, 소듐시트레이트, 시트릭애씨드, 연필향나무오일, 피마자씨오일, 발삼코파이바수지, 광곽향오일, 향기제비꽃잎추출물, 캐모마일꽃오일",순수카렌듈라 메이크업세팅픽서 100ml [업체배송],"12,000원",스킨케어
340,일리윤,https://contents.lotteon.com/itemimage/LB/PD/10/00/60/79/_9/37/3/LBPD10006079_9373_1.jpg/dims/resizef/554X554,제품 상세보기 참조,더마 마일드 클렌징젤 200ml,"9,100원",스킨케어
341,더연,https://contents.lotteon.com/itemimage/LB/PD/10/02/07/79/_3/16/09/LBPD10020779_31609_1.jpg/dims/resizef/554X554,"정제수, 필리핀오렌지추출물, 부틸렌글라이콜, 글리세린, 탄제린추출물, 나이아신아마이드, 1,2-헥산다이올, 비닐다이메티콘, 트라이실록세인, 펜타에리스리틸테트라아이소스테아레이트, 병풀추출물, 쇠비름추출물, 실리카, 베타인, 스테아릭애씨드, 카프릴릭/카프릭트라이글리세라이드, 알지닌, 아크릴레이트/C10-30알킬아크릴레이트크로스폴리머, 황련추출물, 암모늄아크릴로일다이메틸타우레이트/브이피코폴리머, 레몬껍질오일, 알란토인, 아이리쉬모스가루, 아가, 다이포타슘글리시리제이트, 티타늄디옥사이드, 트로메타민, 젤란검, 나이아신(100ppb), 리보플라빈(100ppb), 바이오틴(100ppb), 아스코빅애씨드(100ppb), 토코페롤(100ppb), 판토테닉애씨드(100ppb), 폴릭애씨드(100ppb), 티아민에이치씨엘, 카르니틴에이치씨엘, 다이소듐이디티에이, 에틸헥실글리세린, 시트랄, 리모넨",비타7 씨너지 비타민 크림 100ml [업체배송],"21,900원",스킨케어
342,마몽드,https://contents.lotteon.com/itemimage/LB/PD/10/01/22/66/_1/92/20/LBPD10012266_19220_1.jpg/dims/resizef/554X554,"정제수, 다이메티콘, 에탄올, 글리세린, 프로판다이올, 1,2-헥산다이올, 베타인, 나이아신아마이드, 글리세릴폴리메타크릴레이트, 부틸렌글라이콜, 트라넥사믹애씨드, 암모늄아크릴로일다이메틸타우레이트/브이피코폴리머, 사카라이드아이소머레이트, 세테아릴알코올, 폴리글리세릴-3메틸글루코오스다이스테아레이트, 소듐하이알루로네이트, 잔탄검, 글리세릴카프릴레이트, 하이드로제네이티드레시틴, 글리세릴스테아레이트시트레이트, 에틸헥실글리세린, 하이드록시에틸셀룰로오스, 아데노신, 수크로오스, 향료, 다이소듐이디티에이, 석류추출물, 베타-글루칸, 소듐시트레이트, 시트릭애씨드, 로즈힙열매추출물, 토코페롤, 석류나무꽃추출물, 인돌아세틱애씨드",레드 에너지 리커버리 세럼 30ml,"17,500원",스킨케어
343,헤이네이처,https://contents.lotteon.com/itemimage/LB/PD/10/01/82/07/_2/79/88/LBPD10018207_27988_1.jpg/dims/resizef/554X554,"정제수,약모밀추출물,판테놀,백미꽃추출물,부틸렌글라이콜,편백잎추출물,베타인,글리세린,월계수잎추출물,유칼립투스잎추출물,마데카소사이드,아시아티코사이드,도금양열매추출물,병풀추출물,녹차추출물,황금추출물,마트리카리아꽃추출물,동충하초추출물,레몬밤잎추출물,해당화잎추출물,폴리글리세릴-10라우레이트,폴리글리세릴-10미리스테이트,프로판다이올,1,2-헥산다이올,덱스트린,스클레로튬검,잔탄검,유향나무오일",어성초 앰플 20ml,"21,800원",스킨케어
344,토니모리,https://contents.lotteon.com/itemimage/LB/PD/10/02/16/15/_3/26/21/LBPD10021615_32621_1.jpg/dims/resizef/554X554,"정제수, 부틸렌글라이콜, 메틸프로판다이올, 살구씨오일, 1,2-헥산다이올, 글리세린, 나이아신아마이드, 다이메티콘, 소듐폴리아크릴레이트, 금사연둥지추출물(10,000 ppm), 에틸헥실스테아레이트, 사이클로펜타실록세인, C13-15알케인, 시어버터, C14-22알코올, 세테아릴알코올, 글리세레스-26, 하이드로제네이티드레시틴, 피토스테릴/옥틸도데실라우로일글루타메이트, 폴리글리세릴-10라우레이트, C12-20알킬글루코사이드, 피이지-20글리세릴아이소스테아레이트, 펜틸렌글라이콜, 글리세릴스테아레이트, 피이지-100스테아레이트, 병풀추출물, 트라이데세스-6, 아데노신, 쇠비름추출물, 마트리카리아꽃추출물, 체이스트트리추출물, 토코페릴아세테이트, 다이메티콘/비닐다이메티콘크로스폴리머, 다이글리세린, 테아닌, 인도멀구슬나무잎추출물, 우유지질, 인도멀구슬나무꽃추출물, 울금뿌리추출물, 글루타티온, 덱스트린, 우엉뿌리추출물, 진흙버섯추출물, 카카오추출물, 홀리바질잎추출물, 금, 참산호말추출물, 하이드롤라이즈드콜라겐, 부틸페닐메틸프로피오날, 리모넨, 향료",프리미엄 RX 제비집 아이크림 30ml,"17,900원",스킨케어
345,온더바디,https://contents.lotteon.com/itemimage/LB/PD/10/01/70/90/_2/62/28/LBPD10017090_26228_1.jpg/dims/resizef/554X554,"정제수, 헥실라우레이트, 폴리에틸렌, 세틸팔미테이트, 다이프로필렌글라이콜, 디에칠아미노하이드록시벤조일헥실벤조에이트, 옥토크릴렌, 에칠헥실메톡시신나메이트, 1,2-헥산다이올, 다이메티콘, 에칠헥실살리실레이트, 비스-에칠헥실옥시페놀메톡시페닐트리아진, 피이지-30다이폴리하이드록시스테아레이트, 빙하수, 하이알루로닉애씨드, 소듐하이알루로네이트, 소듐하이알루로네이트크로스폴리머, 마데카소사이드, 아시아티코사이드, 마데카식애씨드, 아시아틱애씨드, 병풀잎추출물, 부틸렌글라이콜, 펜틸렌글라이콜, 에틸헥실글리세린, 잔탄검, 향료",닥터 라이언 쿨링 워터 선스틱 14.5g,"14,900원",스킨케어
346,비페스타,https://contents.lotteon.com/itemimage/LB/PD/10/02/24/22/_3/37/04/LBPD10022422_33704_1.jpg/dims/resizef/554X554,"정제수, 글리세린, 미리스틱애씨드, 스테아릭애씨드, 라우릭애씨드, 포타슘하이드록사이드, 팔미틱애씨드, 말티톨, 셀룰로오스, 글리세릴스테아레이트, 피이지-32, 피이지-6, 알지닌코코에이트, 폴리솔베이트65, 라우라미도프로필베타인, 폴리글리세릴-3카프릴레이트, 폴리쿼터늄-7, 스쿠알란, 부틸렌글라이콜, 테트라소듐이디티에이, 토코페릴아세테이트, 라벤더오일, 씨실트, 락토바실러스/우유발효여과물, 만다린껍질추출물, 하이드록시프로필트라이모늄하이알루로네이트",폼클렌징 모이스트 120g,"9,500원",스킨케어
347,비페스타,https://contents.lotteon.com/itemimage/LB/PD/10/00/03/68/_1/30/LBPD10000368_130_1.jpg/dims/resizef/554X554,"정제수, 에탄올, 글리세린, 피이지-7글리세릴코코에이트, 피이지-6카프릴릭/카프릭글리세라이드, 피이지-20글리세릴디이소스테아레이트, 페녹시에탄올, 메칠파라벤, 소듐스테아로일글루타메이트, 소듐시트레이트, 디소듐이디티에이, 시트릭애씨드, 락틱애씨드 ,비스-글리세릴아스코베이트, 피이지-32,피이지-6",클렌징 시트 브라이트닝 46매,"10,000원",스킨케어
348,바이오더마,https://contents.lotteon.com/itemimage/LB/PD/10/00/01/52/_3/02/LBPD10000152_302_1.jpg/dims/resizef/554X554,"정제수, 글리세린, 자일리톨, 폴리소르베이트20, 피이지-40하이드로제네이티드캐스터오일, 디소듐이디티에이, 알란토인, 세트리모늄브로마이드, 프로필렌글라이콜, 오이추출물, 프룩토올리고사카라이드, 만니톨, 소듐하이드록사이드, 시트릭애씨드, 람노오스",센시비오  토너 250ml,"27,000원",스킨케어
349,싸이닉,https://contents.lotteon.com/itemimage/LB/PD/10/02/17/32/_3/28/14/LBPD10021732_32814_1.jpg/dims/resizef/554X554,"갈락토미세스발효여과물, 글리세린, 나이아신아마이드, 프로판디올, 정제수, 감초수, 마치현추출물, 복분자추출물, 해수, 아데노신, 소듐아스코빌포스페이트, 판테놀, 토코페릴아세테이트, 레티닐팔미테이트, 바이오틴, 티아민에이치씨엘, 폴릭애씨드, 피리독신, 사이아노코발라민, 소듐하이알루로네이트, 알지닌, 카프릴릴글라이콜, 소듐시트레이트, 에칠헥실글리세린, 디소듐이디티에이, 시트릭애씨드, 폴리글리세릴-4카프레이트, 하이드로제네이티드레시틴, 폴리글리세릴-10스테아레이트, 글리세릴리놀리네이트, 글리세릴아라키도네이트, 덱스트린, 칼슘카보네이트, 하이드록시프로필메칠셀룰로오스",퍼스트 트리트먼트 미스트 120ml [업체배송],"13,600원",스킨케어
350,피지오겔,https://contents.lotteon.com/itemimage/LB/PD/10/01/88/18/_2/88/81/LBPD10018818_28881_1.jpg/dims/resizef/554X554,"정제수, 카프릴릭/카프릭트리글리세라이드, 글리세린, 펜틸렌글라이콜, 쉐어버 터, 하이드로제네이티드레시틴, 팔미타마이드엠이에이, 하이드록시에칠셀룰로 오스, 카프릴릴글라이콜, 잔탄검, 베타인, 스쿠알란, 사코신, 아세트아마이드엠 이에이, 소듐카보머, 카보머, 세라마이드엔피(세라마이드3)",레드수딩 AI 로션 100ml,"18,000원",스킨케어
351,아벤느,https://contents.lotteon.com/itemimage/LB/PD/10/01/17/04/_1/84/08/LBPD10011704_18408_1.jpg/dims/resizef/554X554,"아쿠아(아벤느 온천수), C12-15알킬벤조에이트, 메칠렌비스-벤조트리아졸릴테트라메칠부틸페놀, 정제수, 다이아이소프로필아디페이트, 아이소데실네오펜타노에이트, 실리카, 다이카프릴릴카보네이트, 비스에칠헥실옥시페놀메톡시페닐트리아진, 디에칠헥실부타미도트리아존, 알루미늄전분옥테닐석시네이트, 부틸메톡시디벤조일메탄, 포타슘세틸포스페이트, 데실글루코사이드, 1,2-헥산다이올, C10-18트라이글리세라이즈, 글리세릴라우레이트, 브이피/에이코센코폴리머, 향료, 글리세릴스테아레이트, 피이지-100스테아레이트, 잔탄검, 글리세릴다이베헤네이트, 벤조익애씨드, 트라이베헤닌, 아크릴레이트/C10-30알킬아크릴레이트크로스폴리머, 다이소듐이디티에이, 징크글루코네이트, 글리세릴베헤네이트, 프로필렌글라이콜, 부틸렌글라이콜, 토코페릴글루코사이드, 카프릴릭/카프릭트라이글리세라이드, 옥소티아졸리딘, 토코페롤, 소듐벤조에이트",클리낭스 선스크린 50ml,"22,400원",스킨케어
352,유세린,https://contents.lotteon.com/itemimage/LB/PD/10/01/17/12/_1/83/03/LBPD10011712_18303_1.jpg/dims/resizef/554X554,"정제수, 글리세린, 시어버터, 에칠헥실살리실레이트, 부틸메톡시디벤조일메탄, 다이부틸아디페이트, C12-15알킬벤조에이트, 세테아릴알코올, 메틸프로판다이올, 페닐벤즈이미다졸설포닉애씨드, 알루미늄전분옥테닐석시네이트, 알지닌에이치씨엘, 비스-에칠헥실옥시페놀메톡시페닐트리아진, 하이드로제네이티드코코-글리세라이즈, 합성비즈왁스, 페녹시에탄올, 소듐하이드록사이드, 1,2-헥산다이올, 카보머, 요엽후박나무껍질추출물, 메틸메타크릴레이트크로스폴리머, 소듐스테아로일글루타메이트, 향료, 에틸헥실글리세린, 아크릴레이트/C10-30알킬아크릴레이트크로스폴리머, 아니스열매추출물, 트라이소듐이디티에이, 소듐하이알루로네이트, 소듐클로라이드",볼륨 리프팅 데이크림 리치 50ml,"29,900원",스킨케어
353,김정문알로에,https://contents.lotteon.com/itemimage/LB/PD/10/01/75/27/_2/69/06/LBPD10017527_26906_1.jpg/dims/resizef/554X554,"알로에베라잎즙(89.4%),디프로필렌글라이콜,1,2-헥산디올,에탄올,글리세린,트로메타민,카보머,피이지-40하이드로제네이티드캐스터오일,피피지-26-부테스-26,향료,디소듐이디티에이,마치현추출물,베타인,판테놀,정제수,포타슘소르베이트,부틸렌글라이콜,뽕나무뿌리추출물,세이지잎추출물,칸델라브라알로에잎추출물,트레할로스,화이트윌로우껍질추출물,락토바실러스/콩발효추출물,오레가노잎추출물,육계추출물,황금추출물,편백나무잎추출물,로즈마리잎추출물,히비스커스꽃추출물,홍화추출물",큐어 알로에 수딩젤 150ml,"9,900원",스킨케어
354,피지오겔,https://contents.lotteon.com/itemimage/LB/PD/10/01/88/16/_2/88/79/LBPD10018816_28879_1.jpg/dims/resizef/554X554,"정제수, 올리브오일, 글리세린, 펜틸렌글라이콜, 식물성오일, 기름야자오일, 하이드로제네이티드레시틴, 스쿠알란, 베타인, 팔미타마이드엠이에이, 사코신, 아세트아마이드엠이에이, 하이드록시에칠셀룰로오스, 카보머, 소듐카보머, 잔탄검",레드수딩 AI 크림 50ml,"16,800원",스킨케어
355,눅스,https://contents.lotteon.com/itemimage/LB/PD/10/01/32/53/_2/08/66/LBPD10013253_20866_1.jpg/dims/resizef/554X554,"코코-카프릴레이트/카프레이트,퀸즈랜드넛오일,다이카프릴릴에터,카프릴릭/카프릭트라이글리세라이드,스위트아몬드오일,유럽개암씨오일,유차나무씨오일,동백나무씨오일,토코페롤,아르간커넬오일,보리지씨오일,토코페릴아세테이트,해바라기씨오일,로즈마리잎추출물,폴리글리세릴-3다이아이소스테아레이트,아스코빅애씨드,향료,리모넨,리날룰,시트랄,시트로넬올,하이드록시시트로넬알,제라니올",윌 프로디쥬스 멀티 플로럴 오일 100ml 기획,"49,000원",스킨케어
356,닥터아토,https://contents.lotteon.com/itemimage/LB/PD/10/01/63/67/_2/53/72/LBPD10016367_25372_1.jpg/dims/resizef/554X554,"트리에칠헥사노인, 디메치콘, 실리카, 에칠헥실메톡시신나메이트, 페닐트리메치콘, 비닐디메치콘/메치콘실세스퀴옥산크로스폴리머, 마이카 (CI 77019), 에칠헥실살리실레이트, 폴리에칠렌, 파라핀, 디에칠아미노하이드록시벤조일헥실벤조에이트, 비스-에칠헥실옥시페놀메톡시페닐트리아진, 옥토크릴렌, 소르비탄이소스테아레이트, 하이드롤라이즈드식물성단백질, 자일리톨, 마이크로크리스탈린왁스, 트리에톡시카프릴릴실란, 알루미늄하이드록사이드, 스테아릭애씨드, 카프릴릴글라이콜, 글리세릴카프릴레이트, 마데카소사이드, 판테놀, 말토덱스트린, 자일리틸글루코사이드, 무수자일리톨, 정제수, 향료, 티타늄디옥사이드 (CI 77891)",실키 포켓 선스틱 17g,"9,500원",스킨케어
357,하다라보,https://contents.lotteon.com/itemimage/LB/PD/10/01/63/80/_2/53/65/LBPD10016380_25365_1.jpg/dims/resizef/554X554,"정제수, 글리세린, 글리세레스-26, 프로판다이올, 부틸렌글라이콜, 1,2-헥산다이올, 판테놀, 알파-글루칸올리고사카라이드, C12-14파레스-7, 아크릴레이트/C10-30알킬아크릴레이트크로스폴리머, 트로메타민, 트레할로오스, 베타인, 잔탄검, 에틸헥실글리세린, 다이소듐이디티에이, 하이드롤라이즈드하이알루로닉애씨드, 하이드록시프로필트라이모늄하이알루로네이트, 카프릴릭/카프릭트라이글리세라이드, 카보머, 포스파티딜콜린, 하이알루로닉애씨드, 세라마이드엔피, 다이소듐포스페이트, 소듐포스페이트, 사카라이드아이소머레이트, 글리세릴카프릴레이트, 글라이신, 드럼스틱씨오일, 소듐하이알루로네이트, 세린, 글루타믹애씨드, 라이신, 배더락스추출물, 알라닌, 트레오닌, 프롤린, 알지닌, 피토스핑고신, 하이드로제네이티드레시틴",히아풀세라 앰플 30ml,"25,000원",스킨케어
358,에이에이치씨코리아,https://contents.lotteon.com/itemimage/LB/PD/10/01/65/39/_2/55/85/LBPD10016539_25585_1.jpg/dims/resizef/554X554,"정제수, 다이부틸아디페이트, 에탄올, 프로판다이올, 디에칠아미노하이드록시벤조일헥실벤조에이트, 에칠헥실트리아존, 비스-에칠헥실옥시페놀메톡시페닐트리아진, 나이아신아마이드, 카프릴릴메티콘, 소듐아크릴레이트크로스폴리머-2, 다이카프릴릴카보네이트, 펜틸렌글라이콜, 1,2-헥산다이올, 프로폴리스추출물, 멕시칸치아씨오일, 폴리메틸실세스퀴옥세인, 메틸메타크릴레이트크로스폴리머, 실리카, 향료, 카프릴릭/카프릭트라이글리세라이드, 마카다미아씨오일, 지치뿌리추출물, 소듐폴리아크릴로일다이메틸타우레이트, 세틸하이드록시에틸셀룰로오스, 셀룰로오스검, 하이드록시프로필메틸셀룰로오스, 한련초추출물, 폴리아크릴레이트크로스폴리머-6, 다이프로필렌글라이콜, 해바라기씨오일, 칸디다 봄비콜라/글루코오스/메틸레이프씨데이트발효물, 에틸헥실글리세린, 아데노신, 인도멀구슬나무잎추출물, 글리세린, 옥틸도데칸올, 판테놀, 드럼스틱씨오일, t-부틸알코올, 토코페롤, 에키움 플란타기네움씨오일, 타라열매추출물, 해바라기씨오일불검화물, 꽃생강뿌리추출물, 소듐팔미토일프롤린, 서양톱풀추출물, 부틸렌글라이콜, 부시클로버잎/줄기추출물, 코토니추출물, 분홍바늘꽃꽃/잎/줄기추출물, 판토락톤, 마데카소사이드, 카르노신, 풍선덩굴꽃/잎/덩굴추출물, 알파-글루칸올리고사카라이드, 알란토인, 엑토인, 레스베라트롤, 페룰릭애씨드, 아스코빅애씨드, 쇠비름추출물, 피이지-8, 비피다발효용해물, 멘틸락테이트, 에틸멘탄카복사마이드, 하이드로제네이티드레시틴, 폴리글리세릴-10올리에이트, 하이드롤라이즈드콜라겐, 해마토코쿠스 플루비알리스추출물, 메틸다이아이소프로필프로피온아마이드, 카프릴릴글라이콜, 베타-글루칸, 해바라기씨추출물, 피피지-1-피이지-9라우릴글라이콜에터, 하이드록시프로필사이클로덱스트린, 락토바실러스발효물, 서양송악잎/줄기추출물, 세테아릴알코올, 솔비탄스테아레이트, 글리세릴스테아레이트, 알바수련꽃추출물, 세라마이드엔피, 카퍼트라이펩타이드-1, 파이틱애씨드, 하이드록시데실유비퀴논, 소듐폴리아크릴레이트, 글루타티온, 포스파티딜콜린, 다이소듐이디티에이, 프랑스해안송껍질추출물, 아스타잔틴, 글라이신, 바이오틴, 세린, 글루타믹애씨드, 라이신, 알라닌, 프롤린, 알지닌, 트레오닌",프로쉴드 선세럼 퍼펙터 기획 (+폼 50ml),"26,000원",스킨케어
359,얼트루,https://contents.lotteon.com/itemimage/LB/PD/10/00/54/09/_8/32/7/LBPD10005409_8327_1.jpg/dims/resizef/554X554,"정제수, 디프로필렌글라이콜, 글리세린, 에리스리톨, 에탄올, 비스-피이지-18메칠에텔디메칠실란, 판테놀, 피이지-60 하이드로제네이티드캐스터오일, 부틸렌글라이콜, 암모늄아크릴로일디메칠타우레이트/브이피코폴리머, 모란뿌리추출물, 병풀추출물, 폴리아크릴릭애씨드, 1,2-헥산디올, 디메치콘, 캐모마일꽃추출물, 글리세릴카프릴레이트, 포타슘하이드록사이드, 셀룰로오스검, 알란토인, 에칠헥실글리세린, 프로판디올, 대나무잎추출물, 브로콜리싹추출물, 상엽추출물, 치자추출물, 클로렐라추출물, 디이소프로필아디페이트, 메칠디이소프로필프로피온아마이드, 카카오추출물, 판토락톤, 레시틴, 멘틸릭테이트, 아크릴릭애씨드/아크릴아미도메틸프로판설포닉애씨드코폴리머, 금, 디메칠메톡시크로만올, 비피다발효용해물, 달맞이꽃뿌리추출물, 데저트샌드버베나잎추출물, 백년초꽃추출물, 용설란줄기추출물, 잔탄검, 조슈아나무뿌리추출물, 캔들우드줄기추출물, 크레오소트부시추출물, 타마린드씨폴리사카라이드, 트레할로스, 실리카, 미로탐누스 플라벨리폴리아잎추출물, 폴리쿼터늄-51, 물냉이추출물, 글루타치온, 디소듐이디티에이, 페녹시에탄올, 향료",아임쏘리 수딩 젤리 마스크 SOS (진정),"3,000원",스킨케어
360,라포티셀,https://contents.lotteon.com/itemimage/LB/PD/10/00/28/78/_4/99/6/LBPD10002878_4996_1.jpg/dims/resizef/554X554,"정제수, 다이메티콘, 글리세린, 1,2-헥산다이올, 아크릴레이트/C10-30알킬아크릴레이트크로스폴리머, 트로메타민, 프룩토올리고사카라이드, 사카라이드하이드롤리세이트, 잔탄검, 에틸헥실글리세린, 풀루란, 프로판다이올, 아데노신, 병풀추출물, 약모밀추출물, 멕시칸치아씨추출물, 드럼스틱씨오일, 카프릴릴글라이콜, 팔미토일트라이펩타이드-5, 세라마이드엔피, 피토스핑고신, 하이드로제네이티드레시틴, 폴리솔베이트20, 피이지-60하이드로제네이티드캐스터오일, 아세틸헥사펩타이드-8, 페녹시에탄올",울트라 리프트 데일리 에센스 40ml,"24,700원",스킨케어
361,파티온,https://contents.lotteon.com/itemimage/LB/PD/10/02/04/43/_2/62/85/LBPD10020443_26285_1.jpg/dims/resizef/554X554,"정제수, 글리세린, 라우릴하이드록시설테인, 포타슘코코일글리시네이트, 아크릴레이트코폴리머, 1,2-헥산다이올, 데실글루코사이드, 소듐메틸코코일타우레이트, 소듐클로라이드, 소듐헤파린, 판테놀, 알란토인, 쑥잎추출물, 트로메타민, 시트릭애씨드, 베르가모트오일, 센티드제라늄꽃오일, 솔비톨, 부틸렌글라이콜, 에탄올, 광곽향오일, 살비아오일, 소듐카보네이트, 판토락톤, 다이소듐이디티에이, 에틸헥실글리세린",노스캄 리페어 클렌징 젤 200ml,"15,400원",스킨케어
