,brand,image,ingredient,name,price,category
954,스웨거,https://contents.lotteon.com/itemimage/LB/PD/10/01/98/41/_3/03/62/LBPD10019841_30362_1.jpg/dims/resizef/554X554,"정제수, 폴리솔베이트20, 프로필렌글라이콜, 세테아레스-20, 다이메티콘, 피브이피, 사이클로펜타실록세인, 페닐트라이메티콘, 글리세린, 스테아릴알코올, 세틸알코올, 1,2-헥산다이올, 글리세릴스테아레이트, 폴리솔베이트80, 다이메티콘올, 세트리모늄클로라이드, 피이지-100스테아레이트, 스테아트라이모늄클로라이드, 에틸헥실글리세린, 하이드롤라이즈드콜라겐, 해수, 동백나무씨오일, 아르간커넬오일, 밤부사불가리스수, 부틸렌글라이콜, 로즈마리잎추출물, 라벤더꽃추출물, 페퍼민트잎추출물, 베르가못잎추출물, 마트리카리아꽃추출물, 프리지어추출물, 하이드로제네이티드레시틴, 글라이신, 폴리글리세릴-10스테아레이트, 세린, 글루타믹애씨드, 판테놀, 아스파틱애씨드, 류신, 토코페릴아세테이트, 소듐아스코빌포스페이트, 알라닌, 라이신, 알지닌, 타이로신, 페닐알라닌, 트레오닌, 프롤린, 발린, 아이소류신, 히스티딘, 메티오닌, 시스테인, 글리세릴리놀리네이트, 글리세릴아라키도네이트, 바이오틴, 폴릭애씨드, 티아민에이치씨엘, 레티닐팔미테이트, 피리독신, 사이아노코발아민",하이드레이터 컬크림 100g,"9,900원",헤어
955,트리트룸,https://contents.lotteon.com/itemimage/LB/PD/10/01/68/56/_2/59/54/LBPD10016856_25954_1.jpg/dims/resizef/554X554,"정제수, 세틸알코올, 베헤닐알코올 외 상세페이지 참조",시그니처 트리트먼트 베이비파우더 1077ml,"11,000원",헤어
956,베네자임,https://contents.lotteon.com/itemimage/LB/PD/10/02/27/95/_3/42/82/LBPD10022795_34282_1.jpg/dims/resizef/554X554,"[단백질헤어앰플미스트]사이클로펜타실록세인, 다이실록세인, 변성알코올, 다이페닐실록시페닐트라이메티콘, 다이메티콘, 향료, 카프릴릭/카프릭트라이글리세라이드, 정제수, 아르간커넬오일, 마카다미아씨오일, 아보카도오일, 스위트아몬드오일, 피탄트라이올, 부틸렌글라이콜, 콜라겐, 하이드롤라이즈드콜라겐, 젤라틴, 하이드롤라이즈드케라틴, 귀리커넬추출물, 글라이신, 세린, 글루타믹애씨드, 하이드롤라이즈드옥수수단백질, 하이드롤라이즈드콩단백질, 하이드롤라이즈드밀단백질, 아스파틱애씨드, 류신, 알라닌, 라이신, 알지닌, 타이로신, 페닐알라닌, 프롤린, 트레오닌, 발린, 아이소류신, 히스티딘, 시스테인, 메티오닌 [리커버리헤어밤]정제수, 에탄올, 부틸렌글라이콜, 피이지-60하이드로제네이티드캐스터오일, 트라이에틸시트레이트, 1,2-헥산다이올, 향료, 트라이데세스-10, 알지닌, 멘톨, 피이지-75라놀린, 살리실릭애씨드, 판테놀, 덱스트린, 알란토인, 글리세린, 사이클로덱스트린, 다이프로필렌글라이콜, 말토스, 글루코오스, 하이드록시프로필사이클로덱스트린, 소듐구아이아줄렌설포네이트, 치자추출물, 참당귀뿌리추출물, 측백나무잎추출물, 녹차추출물, 울금뿌리추출물, 한련초추출물, 하수오뿌리추출물, 황금추출물, 쓴풀추출물, 달맞이꽃추출물, 대왕송잎추출물, 칡뿌리추출물, 당느릅나무뿌리추출물, 잇꽃꽃추출물, 당개나리열매추출물, 은행나무잎추출물, 돌콩추출물, 감초뿌리추출물, 인삼추출물, 오미자추출물, 미역추출물, 생강추출물, 석창포추출물, 쑥잎추출물, 산구절초추출물, 산수유열매추출물, 무화과추출물, 영지버섯추출물, 약모밀추출물, 고삼뿌리추출물, 아세틱애씨드, 아스퍼질러스발효물",앰플미스트250ml+헤어밤150ml [업체배송],"19,800원",헤어
957,밀크바오밥,https://contents.lotteon.com/itemimage/LB/PD/10/02/16/68/_3/27/37/LBPD10021668_32737_1.jpg/dims/resizef/554X554,"정제수, 세테아릴알코올, 사이클로펜타실록세인, 사이클로헥사실록세인, 베헨트라이모늄클로라이드, 부틸렌글라이콜, 글리세린, 올리브오일, 아르간커넬오일, 우유단백질추출물(2,000ppm), 바오밥나무씨추출물(2,000ppm), 하이드롤라이즈드케라틴(2,000ppm), 하이드롤라이즈드엘라스틴, 하이드롤라이즈드하이알루로닉애씨드, 하이알루로닉애씨드, 하이드롤라이즈드소듐하이알루로네이트, 카프릴릭/카프릭트라이글리세라이드, 레시틴, 팔미토일펜타펩타이드-4, 카퍼트라이펩타이드-1, 아세틸헥사펩타이드-8, 알바프리지어추출물, 작약꽃추출물, 은방울꽃추출물, 수국잎추출물, 소듐하이알루로네이트, 소듐하이알루로네이트크로스폴리머, 폴리솔베이트20, 시트릭애씨드, 다이메티콘, 라우레스-3, 라우레스-23, 아모다이메티콘, 세트리모늄클로라이드, 트라이데세스-12, 소듐아스코빌포스페이트, 1,2-헥산다이올, 카프릴릴글라이콜, 소듐벤조에이트, 다이소듐이디티에이, 향료, 알파-아이소메틸아이오논, 벤질벤조에이트, 벤질살리실레이트, 시트로넬롤, 리모넨, 제라니올, 헥실신남알, 리날룰",퍼퓸 트리트먼트 플로라부케 500ml  [1+1],"8,900원",헤어
958,로레알 파리,https://contents.lotteon.com/itemimage/LB/PD/10/00/23/15/_4/06/0/LBPD10002315_4060_1.jpg/dims/resizef/554X554,사이클로펜타실록산 디메치콘올 캐모마일꽃추출물 코코넛오일 하이드록시시트로넬알 해바라기씨오일 연꽃추출물 리모넨 벤질살리실레이트 벤질알코올 리날룰 아마인꽃추출물 이소유제놀 카프릴릭/카프릭트리글리세라이드 제라니올 띠아레꽃추출물 로즈힙꽃추출물 비사볼올 헥실신남알 콩오일 향료,엑스트라 오디네리 리치 브라운 100ml,"15,900원",헤어
959,미쟝센,https://contents.lotteon.com/itemimage/LB/PD/10/00/32/89/_5/48/2/LBPD10003289_5482_1.jpg/dims/resizef/554X554,"정제수, 세테아릴알코올, 디메치콘, 쉐어버터, 스테아라미도프로필디메칠아민, 세테아릴올리베이트, 스테아트리모늄클로라이드, 아모디메치콘, 아르간트리커넬오일, 동백오일(카멜리아), 비르씨오일(마룰라), 올리브오일, 호호바씨오일, 코코넛오일, 행인오일(아프리코트), 소르비탄올리베이트, 이소프로필알코올, 글라이코리피드, 적색227호, 황색5호, 락틱애씨드, 카프릴릴글라이콜, 디소듐이디티에이, 페녹시에탄올, 코코-카프릴레이트/카프레이트, 하이드로제네이티드폴리이소부텐, 트리데세스-10, 피이지-32,향료",퍼펙트 리페어 트리트먼트팩 330ml,"6,500원",헤어
960,미쟝센,https://contents.lotteon.com/itemimage/LB/PD/10/00/40/07/_6/60/3/LBPD10004007_6603_1.jpg/dims/resizef/554X554,제품 상세보기 참조,데미지 케어 샴푸 530ml,"3,900원",헤어
961,로레알 파리,https://contents.lotteon.com/itemimage/LB/PD/10/01/59/04/_2/46/22/LBPD10015904_24622_1.jpg/dims/resizef/554X554,"[염모제 - 엑셀랑스 크림 1호] 정제수 세테아릴알코올 데세스-3 프로필렌글라이콜 라우레스-12 올레스-30 암모늄하이드록사이드 헥사다이메트린클로라이드 라우릭애씨드 글라이콜다이스테아레이트 폴리쿼터늄-22 에탄올아민 p-페닐렌디아민 실리카다이메틸실릴레이트 티타늄디옥사이드 염산2,4-디아미노페녹시에탄올 m-아미노페놀 아스코빅애씨드 암모늄티오락테이트 다이메티콘 펜타소듐펜테테이트 황산N,N-비스(2-히드록시에칠)-p-페닐렌디아민 리날룰 프롤린 카보머 트레오닌 레조시놀 부틸페닐메틸프로피오날 향료  [염모제 - 엑셀랑스 크림 3호] 정제수 세테아릴알코올 프로필렌글라이콜 데세스-3 라우레스-12 암모늄하이드록사이드 올레스-30 헥사다이메트린클로라이드 라우릭애씨드 글라이콜다이스테아레이트 폴리쿼터늄-22 p-페닐렌디아민 에탄올아민 실리카다이메틸실릴레이트 티타늄디옥사이드 염산2,4-디아미노페녹시에탄올 m-아미노페놀 아스코빅애씨드 소듐메타바이설파이트 히드록시벤조모르포린 다이메티콘 펜타소듐펜테테이트 리날룰 프롤린 카보머 트레오닌 레조시놀 부틸페닐메틸프로피오날 향료  [염모제 - 엑셀랑스 크림 4호] 정제수 세테아릴알코올 프로필렌글라이콜 데세스-3 라우레스-12 암모늄하이드록사이드 올레스-30 헥사다이메트린클로라이드 라우릭애씨드 글라이콜다이스테아레이트 폴리쿼터늄-22 레조시놀 에탄올아민 p-페닐렌디아민 실리카다이메틸실릴레이트 티타늄디옥사이드 염산2,4-디아미노페녹시에탄올 m-아미노페놀 아스코빅애씨드 소듐메타바이설파이트 염산히드록시프로필비스(N-히드록시에칠-p-페닐렌디아민) 다이메티콘 펜타소듐펜테테이트 황산N,N-비스(2-히드록시에칠)-p-페닐렌디아민 리날룰 프롤린 카보머 트레오닌 부틸페닐메틸프로피오날 향료  [염모제 - 엑셀랑스 크림 4.15호] 정제수 세테아릴알코올 프로필렌글라이콜 데세스-3 라우레스-12 암모늄하이드록사이드 올레스-30 헥사다이메트린클로라이드 라우릭애씨드 글라이콜다이스테아레이트 폴리쿼터늄-22 에탄올아민 실리카다이메틸실릴레이트 티타늄디옥사이드 염산2,4-디아미노페녹시에탄올 m-아미노페놀 p-아미노페놀 2-아미노-3-히드록시피리딘 아스코빅애씨드 소듐메타바이설파이트 6-히드록시인돌 다이메티콘 펜타소듐펜테테이트 리날룰 프롤린 p-페닐렌디아민 카보머 트레오닌 레조시놀 부틸페닐메틸프로피오날 향료  [염모제 - 엑셀랑스 크림 5.15호] 정제수 세테아릴알코올 프로필렌글라이콜 데세스-3 라우레스-12 암모늄하이드록사이드 올레스-30 헥사다이메트린클로라이드 라우릭애씨드 글라이콜다이스테아레이트 폴리쿼터늄-22 에탄올아민 실리카다이메틸실릴레이트 티타늄디옥사이드 염산2,4-디아미노페녹시에탄올 m-아미노페놀 p-아미노페놀 2-아미노-3-히드록시피리딘 아스코빅애씨드 소듐메타바이설파이트 6-히드록시인돌 다이메티콘 펜타소듐펜테테이트 리날룰 프롤린 p-페닐렌디아민 카보머 트레오닌 레조시놀 부틸페닐메틸프로피오날 향료  [염모제 - 엑셀랑스 크림 5.35호] 정제수 세테아릴알코올 데세스-3 프로필렌글라이콜 라우레스-12 암모늄하이드록사이드 올레스-30 헥사다이메트린클로라이드 라우릭애씨드 글라이콜다이스테아레이트 폴리쿼터늄-22 에탄올아민 실리카다이메틸실릴레이트 p-아미노페놀 티타늄디옥사이드 m-아미노페놀 5-아미노-o-크레솔 아스코빅애씨드 소듐메타바이설파이트 2-메칠레조시놀 암모늄티오락테이트 2-메칠-5-히드록시에칠아미노페놀 다이메티콘 펜타소듐펜테테이트 리날룰 프롤린 p-페닐렌디아민 카보머 트레오닌 레조시놀 부틸페닐메틸프로피오날 향료  [염모제 - 엑셀랑스 크림 5.6호] 정제수 세테아릴알코올 데세스-3 프로필렌글라이콜 라우레스-12 암모늄하이드록사이드 올레스-30 헥사다이메트린클로라이드 라우릭애씨드 글라이콜다이스테아레이트 폴리쿼터늄-22 에탄올아민 실리카다이메틸실릴레이트 티타늄디옥사이드 p-아미노페놀 5-아미노-o-크레솔 m-아미노페놀 아스코빅애씨드 히드록시벤조모르포린 소듐메타바이설파이트 암모늄티오락테이트 2-메칠-5-히드록시에칠아미노페놀 2-메칠레조시놀 다이메티콘 펜타소듐펜테테이트 리날룰 프롤린 p-페닐렌디아민 카보머 트레오닌 레조시놀 부틸페닐메틸프로피오날 향료  [염모제 - 엑셀랑스 크림 6.30호] 정제수 세테아릴알코올 프로필렌글라이콜 데세스-3 라우레스-12 암모늄하이드록사이드 올레스-30 헥사다이메트린클로라이드 라우릭애씨드 글라이콜다이스테아레이트 폴리쿼터늄-22 에탄올아민 실리카다이메틸실릴레이트 티타늄디옥사이드 p-아미노페놀 m-아미노페놀 아스코빅애씨드 소듐메타바이설파이트 티오글리세린 톨루엔-2,5-디아민 2-메칠레조시놀 2-메칠-5-히드록시에칠아미노페놀 다이메티콘 펜타소듐펜테테이트 리날룰 프롤린 카보머 트레오닌 레조시놀 부틸페닐메틸프로피오날 향료  [염모제 - 엑셀랑스 크림 7.01호] 정제수 세테아릴알코올 프로필렌글라이콜 데세스-3 라우레스-12 암모늄하이드록사이드 올레스-30 헥사다이메트린클로라이드 라우릭애씨드 글라이콜다이스테아레이트 폴리쿼터늄-22 에탄올아민 실리카다이메틸실릴레이트 티타늄디옥사이드 염산2,4-디아미노페녹시에탄올 m-아미노페놀 아스코빅애씨드 소듐메타바이설파이트 다이메티콘 펜타소듐펜테테이트 리날룰 프롤린 p-페닐렌디아민 카보머 트레오닌 레조시놀 부틸페닐메틸프로피오날 향료  [산화제 - 모든 호수 동일성분] 정제수 과산화수소수(50%) 세테아릴알코올 소듐스타네이트 트라이데세스-2카복사마이드엠이에이 펜타소듐펜테테이트 포스포릭애씨드 세테아레스-25 테트라소듐파이로포스페이트 글리세린",엑셀랑스크림 염색약 NEW,"10,900원",헤어
962,프레시팝,https://contents.lotteon.com/itemimage/LB/PD/10/01/64/66/_2/54/79/LBPD10016466_25479_1.jpg/dims/resizef/554X554,제품 상세보기 참조,만다린&유자샴푸 비듬샴푸 500ml,"7,500원",헤어
963,썬실크,https://contents.lotteon.com/itemimage/LB/PD/10/02/29/46/_3/44/76/LBPD10022946_34476_1.jpg/dims/resizef/554X554,"정제수, 다이메티콘, 세테아릴알코올, 글리세린, 프로 필렌글라이콜, 사이클로펜타실록세인, 베헨트라이모늄클로라이드, 세트리모늄클로라이드, 하이드록시에틸셀룰로오스, 라우레스-3, 라우레스-23, 하이드롤라이즈드케라틴, 시트릭애씨드, 소듐벤조에이트, 소듐시트레이트, 잔탄검, 판테놀, 아르간커넬오일, 해바라기씨오일, 우유단백질추출물, 검정콩추출물, 검은깨추출물, 흑미추출물, 수크로오스팔미테이트, 하이드로제네이티드레시틴, 1,2-헥산다이올, 호호바씨오일, 포도씨오일, 올리브오일, 마카다미아씨오일, 토코페롤, 페녹시에탄올, 에틸헥실글리세린, 다이소듐이디티에이, 황색4호, 황색 5호, 향료, 쿠마린, 리날룰, 리모넨",데미지리스토어 트리트먼트 300ML,"5,900원",헤어
964,제이숲,https://contents.lotteon.com/itemimage/LB/PD/10/02/26/21/_3/40/05/LBPD10022621_34005_1.jpg/dims/resizef/554X554,"정제수, 세테아릴알코올, 쿼터늄-87, 벤질알코올, 쿼터늄-91, 프로필렌글라이콜, 스테아라미도프로필다이메틸아민, 글리세린, 세트리모늄메토설페이트, 카프릴릴글라이콜, 시트릭애씨드, 향료, 글리세릴스테아레이트, 피이지-100스테아레이트, 폴리쿼터늄-10, 리모넨, 다이소듐이디티에이, 리날룰, 벤질벤조에이트, 하이드록시에틸셀룰로오스, 부틸렌글라이콜, 베헨트라이모늄클로라이드, 세트리모늄클로라이드, 하이드롤라이즈드실크, 흰버드나무껍질추출물, 편백잎추출물, 오레가노잎추출물, 락토바실러스/콩발효추출물, 쇠비름추출물, 육계나무껍질추출물, 황금추출물, [+/-]염기성청색99호, [+/-]염기성갈색16호, [+/-]염기성적색51호, [+/-]염기성등색31호, [+/-]염기성황색87호, [+/-]에이치씨청색15호",컬러제이 헤어팩,"14,000원",헤어
965,리더스,https://contents.lotteon.com/itemimage/LB/PD/10/01/29/28/_2/03/63/LBPD10012928_20363_1.jpg/dims/resizef/554X554,"정제수,펜틸렌글라이콜,부틸렌글라이콜,베르가모트오일,돌콩추출물,자일리틸글루코사이드,자일리톨,귀리커넬단백질,하이드롤라이즈드케라틴,돌콩단백질,록샘파이어캘러스배양여과물,하이드롤라이즈드식물성단백질,피이지/피피지-17/6코폴리머,옥틸도데세스-16,피이지-60하이드로제네이티드캐스터오일,에틸헥실글리세린,하이드로제네이티드폴리아이소부텐,카프릴릴글라이콜,아크릴레이트/C10-30알킬아크릴레이트크로스폴리머,아미노메틸프로판올,글리세린,하이드록시에틸아크릴레이트/소듐아크릴로일다이메틸타우레이트코폴리머,1,2-헥산다이올,옥탄다이올,폴리솔베이트60,솔비탄아이소스테아레이트,안하이드로자일리톨,토코페롤,글루코오스,말토덱스트린,잔탄검,다이소듐이디티에이,",헤어라피 앰플 10ml 6ea,"11,000원",헤어
966,미쟝센,https://contents.lotteon.com/itemimage/LB/PD/10/00/44/13/_7/09/5/LBPD10004413_7095_1.jpg/dims/resizef/554X554,"제1제:정제수, 피이지-8, 에탄올아민, 황산 1-히드록시에칠-4,5-디아미노피라졸, 염산 2,4-디아미노페녹시에탄올, 디소듐이디티에이, 시스테인에이치씨엘, 에리소빅애씨드 / 제2제:정제수, 과산화수소, 코카미도프로필베타인, 디프로필렌글라이콜, 피이지-150디스테아레이트, 소듐메칠코코일타우레이트, 소듐벤조에이트, 에티드로닉애씨드, 포스포릭애씨드, 향료 / 제3제:정제수, 디프로필렌글라이콜, 폴리쿼터늄-6, 라벤더꽃수, 마돈나백합비늘줄기추출물, 캐모마일꽃추출물",헬로버블 7P 사하라 로즈 핑크 30G,"7,000원",헤어
967,부케가르니,https://contents.lotteon.com/itemimage/LB/PD/10/02/14/96/_3/24/89/LBPD10021496_32489_1.jpg/dims/resizef/554X554,"정제수, 소듐라우레스설페이트, 코카미도프로필베타인, 암모늄라우릴설페이트, 소듐클로라이드, 향료, 다이소듐코코암포다이아세테이트, 헥실렌글라이콜, 시트릭애씨드, 다이메티콘, C12-15파레스-3, 구아하이드록시프로필트라이모늄클로라이드, 살리실릭애씨드, 바바수아미도프로필베타인, 트라이하이드록시스테아린, 펜타소듐펜테테이트, 라우레스-23, 라우레스-4, 폴리쿼터늄-10, 피피지-3카프릴릴에터, 폴리쿼터늄-67, 부틸렌글라이콜, 글리세린, 하이드롤라이즈드콜라겐, 하이드롤라이즈드밀단백질, 하이드롤라이즈드케라틴, 하이드롤라이즈드실크, 하이드롤라이즈드옥수수단백질, 하이드롤라이즈드콩단백질, 소듐피씨에이, 소듐락테이트, 알지닌, 아스파틱애씨드, 피씨에이, 글라이신, 알라닌, 세린, 발린, 트레오닌, 프롤린, 아이소류신, 히스티딘, 페닐알라닌, 시카카이열매추출물, 퀸즈랜드넛오일, 올리브오일, 해바라기씨오일, 호호바씨오일, 아르간커넬오일, 1,2-헥산다이올, 카프릴릴글라이콜, 소듐벤조에이트, 페녹시에탄올, 트로폴론, 알파-아이소메틸아이오논, 벤질벤조에이트, 시트로넬올, 쿠마린, 리모넨, 제라니올, 하이드록시시트로넬알, 리날룰",샴푸 베이비파우더 1L,"12,900원",헤어
968,마쉐리,https://contents.lotteon.com/itemimage/LB/PD/10/00/34/56/_5/82/3/LBPD10003456_5823_1.jpg/dims/resizef/554X554,"정제수, 에탄올, 디메치콘, 프로필렌글라이콜, 글리세린, 아미노프로필디메치콘, 아미노메칠프로판올, 카보머, 향료, 아크릴레이트/C10-30알킬아크릴레이트크로스폴리머, 잔탄검, 피이지-10디메치콘, 하이드록시에칠우레아, 디소듐이디티에이, 락틱애씨드, 꿀, 암모늄락테이트, 부틸렌글라이콜, 소듐하이알루로네이트, 토코페롤, 하이드롤라이즈드콘키올린프로테인",아쿠아듀 에너지 EX 120g,"16,000원",헤어
969,프레쉬라이트,https://contents.lotteon.com/itemimage/LB/PD/10/01/88/87/_2/89/54/LBPD10018887_28954_1.jpg/dims/resizef/554X554,"제1제 염모제:  정제수, 세테아릴알코올, 암모늄하이드록사이드, 미네랄오일, 글리세린, 스테아레스-100, 세테아레스-30, 아모디메치콘, 스테아트라이모늄클로라이드, 소듐설파이트, 폴리쿼터늄-22, 아스코빅애씨드, 이소프로필알코올, 황산톨루엔-2, 5-디아민, 테트라소듐이디티에이, 향료, 레조시놀, 염산2, 4-디아미노페녹시에탄올, p-아미노페놀, 포도씨오일, 베타인, 소듐피씨에이, 솔비톨, 세린, 글라이신, 글루타믹애씨드, 알라닌, 알지닌, 라이신, 트레오닌, 프롤린, 부틸페닐메틸프로피오날, 리날룰   제2제 산화제: 정제수, 하이드로젠퍼옥사이드, 세테아릴알코올, 미네랄오일, 프로필렌글라이콜, 세테아레스-30, 글리세릴스테아레이트, 코카미도프로필베타인, 에티드로닉애씨드,  펜타소듐펜테테이트   프레쉬라이트 오일 헤어 마스크(비매품) :  정제수, 세테아릴알코올, 아이소프로필미리스테이트, 다이메티콘, 베헨트라이모늄클로라이드, 다이스테아로일에틸하이드록시에틸모늄메토설페이트, 스테아라미도프로필다이메틸아민, 비스아미노피이지/피피지-41/3아미노에틸피지-프로필다이메티콘, 하이드롤라이즈드케라틴, 마카다미아씨오일,  판테놀, 폴리쿼터늄-10, 해바라기씨오일, 유채씨오일, 살구씨오일, 스위트아몬드오일, 아마씨오일, 흰무늬엉겅퀴씨오일, 퐁감씨오일, 퀸즈랜드넛오일, 잇꽃씨오일, 아보카도오일, 포도씨오일, 참깨오일, 세트리모늄클로라이드, 시트릭애씨드, 페녹시에탄올, 아이소프로필알코올, 다이프로필렌글라이콜, 메틸파라벤, 향료, 벤질알코올, 벤질살리실레이트, 리몬넨, 헥실신남알, 부틸페닐메틸프로피오날, 리날룰",미스티 바이올렛,"6,500원",헤어
970,엘라스틴,https://contents.lotteon.com/itemimage/LB/PD/10/01/65/74/_2/56/32/LBPD10016574_25632_1.jpg/dims/resizef/554X554,"1제: 정제수, 에탄올아민, 세테아릴알코올, 올레스-30, 올레일알코올, 부틸렌글라이콜, 비스(C13-15알콕시)피지-아모다이메티콘, 판테놀, 호호바씨오일, 아르간커넬오일, 메도우폼씨오일, 글라이신, 세린, 글루타믹애씨드, 아스파틱애씨드, 류신, 알라닌, 라이신, 알지닌, 타이로신, 페닐알라닌, 트레오닌, 프롤린, 발린, 아이소류신, 히스티딘, 시스테인, 메티오닌, 글리세린, 로얄젤리추출물, 프로폴리스추출물, 알지닌/라이신폴리펩타이드, 세테아레스-3, 하이드로제네이티드팜오일, 아크릴레이트/C10-30알킬아크릴레이트크로스폴리머, 피이지-40하이드로제네이티드캐스터오일, 하이드로제네이티드폴리데센, 피피지-3미리스틸에터, 비에이치티, 피이지-150/데실알코올/에스엠디아이코폴리머, 프로필렌글라이콜, 코카마이드엠이에이, 다이세틸포스페이트, 세테스-20포스페이트, 살리실릭애씨드, 에리소빅애씨드, 시스테인에이치씨엘, 테트라소듐이디티에이, 소듐메타바이설파이트, 에탄올, 폴리솔베이트20, 포타슘카보네이트, 소르빅애씨드, 토코페롤, 피이지-크로스폴리머, p-페닐렌디아민, 황산 톨루엔-2,5-디아민, p-아미노페놀, 황산 p-메칠아미노페놀, 레조시놀, 5-아미노-o-크레솔, m-아미노페놀, 페녹시에탄올, 향료, 리모넨, 벤질벤조에이트, 시트랄, 리날룰  2제: 정제수, 과산화수소수 35%, 세테아릴알코올, 세테스-40, 미네랄오일, 피이지-40하이드로제네이티드캐스터오일, 세테스-15, 피이지-2다이메도우폼아미도에틸모늄메토설페이트, 피이지-150/데실알코올/에스엠디아이코폴리머, 글리세릴스테아레이트, 에티드로닉애씨드, 포스포릭애씨드, 다이소듐포스페이트, 프로필렌글라이콜, 헥실렌글라이콜",살롱드컬러 자연갈색,"4,950원",헤어
971,로레알 파리,https://contents.lotteon.com/itemimage/LB/PD/10/01/04/18/_1/65/01/LBPD10010418_16501_1.jpg/dims/resizef/554X554,"사이클로펜타실록세인 다이메티콘올 에탄올 리모넨 벤질살리실레이트 벤질알코올 리날룰 2-올레아미도-1,3-옥타데칸다이올 알파-아이소메틸아이오논 시트로넬올 헥실신나몰 글리세릴리놀리에이트 글리세릴올리에이트 글리세릴리놀리네이트 향료",토탈리페어 5 세럼 프로엑스,"13,500원",헤어
