,brand,image,ingredient,name,price,category
655,폴라초이스,https://contents.lotteon.com/itemimage/LB/PD/10/01/62/33/_2/51/84/LBPD10016233_25184_1.jpg/dims/resizef/554X554,"사이클로펜타실록세인(보습), 다이메티콘올(보습/질감향상제), 네오펜틸글라이콜다이헵타노에이트(연화제), 다이카프릴릴카보네이트(연화제), 카프릴릭/카프릭트라이글리세라이드(보습/피부영양), 페닐트라이메티콘(보습), 스쿠알란(연화제), 비사보롤(피부진정), 테트라헥실데실아스코베이트(비타민C/항산화제), 레티놀(0.112%)(항산화제), 토코트리엔올(비타민E베이스항산화제), 토코페롤(비타민E/항산화제), 레시틴, 라미나리아 오크롤레우카추출물(피부진정), 귀리커넬오일(피부진정), 오일팜오일(피부영양), 스테아릴글리시레티네이트(피부진정), 헥실렌글라이콜(보습), 카프릴릴글라이콜(보존제), 에틸헥실글리세린(보존제), 페녹시에탄올(보존제)",리지스트 인텐시브 레티놀 세럼 30ml,"44,800원",스킨케어
656,뉴트로지나,https://contents.lotteon.com/itemimage/LB/PD/10/00/87/05/_1/36/69/LBPD10008705_13669_1.jpg/dims/resizef/554X554,"정제수, 피이지-6카프릴릭/카프릭글리세라이드, 폴리소르베이트20, 부틸렌글라이콜, 피이지-8, 폴록사머407, 시트릭애씨드, 소듐벤조에이트, 디소듐이디티에이, 마치현추출물",딥클린 미셀라 퓨리파잉 클렌징워터 400ml,"10,500원",스킨케어
657,스킨천사,https://contents.lotteon.com/itemimage/LB/PD/10/01/62/63/_2/52/12/LBPD10016263_25212_1.jpg/dims/resizef/554X554,"병풀추출물,정제수,다이프로필렌글라이콜,글리세레스,글리세린 등",센텔라 워터겔 앰플 마스크팩,"3,000원",스킨케어
658,듀이트리,https://contents.lotteon.com/itemimage/LB/PD/10/01/14/57/_1/80/36/LBPD10011457_18036_1.jpg/dims/resizef/554X554,"정제수, 징크옥사이드, 프로필헵틸카프릴레이트, 프로판다이올, 티타늄디옥사이드, 부틸렌글라이콜다이카프릴레이트/다이카프레이트, 다이카프릴릴에터, 다이실록세인, 부틸옥틸살리실레이트, 카프릴릴메티콘, 폴리글리세릴-4다이아이소스테아레이트/폴리하이드록시스테아레이트/세바케이트, 칼라민, 트라이메틸실록시실리케이트, 사막장미잎세포추출물, 로즈오브예리코추출물, 로즈마리잎오일, 잇꽃씨오일, 다이스테아다이모늄헥토라이트, 마그네슘설페이트, 스테아릭애씨드, 알루미늄하이드록사이드, 트라이에톡시카프릴릴실레인, 메틸메타크릴레이트크로스폴리머, 폴리글리세릴-3폴리다이메틸실록시에틸다이메티콘, 1,2-헥산다이올, 비닐다이메티콘/메티콘실세스퀴옥세인크로스폴리머, 폴리메틸실세스퀴옥세인, 글리세릴카프릴레이트, 카프릴릴글라이콜, 에틸헥실글리세린, 토코페롤, 부틸렌글라이콜, 바이오사카라이드검-4, 흰목이버섯폴리사카라이드",어반쉐이드 안티 폴루션 선크림기획(+클렌징폼 50ml),"15,000원",스킨케어
659,눅스,https://contents.lotteon.com/itemimage/LB/PD/10/01/09/82/_1/73/60/LBPD10010982_17360_1.jpg/dims/resizef/554X554,"정제수,다이카프릴릴에터,변성알코올,글리세린,스쿠알란,다이메티콘,퀸즈랜드넛오일,하이드록시에틸아크릴레이트/소듐아크릴로일다이메틸타우레이트코폴리머,옥틸도데칸올,페녹시에탄올,토코페롤,에틸헥실글리세린,아크릴레이트/C10-30알킬아크릴레이트크로스폴리머,리보오스,소듐글루코네이트,코치닐선인장꽃추출물,부틸렌글라이콜,소듐스테아로일글루타메이트,잔탄검,폴리솔베이트60,솔비탄아이소스테아레이트,펜틸렌글라이콜,커먼자스민꽃추출물,팩스추출물,소듐하이드록사이드,바이오사카라이드검-1,마이카,적색산화철,포트마리골드꽃추출물,향료,벤질살리실레이트,리날룰,시트로넬올,알파-아이소메틸아이오논,제라니올",에너지 부스트 나이트 리커버리 밤 50ml,"48,000원",스킨케어
660,메디힐,https://contents.lotteon.com/itemimage/LB/PD/10/00/06/93/_2/20/LBPD10000693_220_1.jpg/dims/resizef/554X554,"1단계:정제수, 위치하젤수, 부틸렌글라이콜, 세이지잎수, 소듐라우로일시코시네이트, 페녹시에탄올, 피이지-60하이드로제네이티드캐스터오일, 두송열매추출물, 레몬밤잎추출물, 벼독뿌리추출물, 페퍼민트잎추출물, 버독뿌리추출물, 페퍼민트잎추출물, 향료,리날룰, 카프릴릴글라이콜, 비누풀잎추출물, 서양고추나물추출물, 1,2-헥산디올, 프로판디올, 시트릭애씨드, 팔각회향추출물, 녹차추출물, 라임추출물, 라임추출물, 알란토인, 캐모마일꽃추출물, 사과추출물, 자몽추출물/2단계:정제수, 피브이피, 디메치콘코폴리올, 카올린, 티타늄디옥사이드, 브이피/브이에이코폴리머, 프로필렌글라이콜, 메칠파라벤, 레몬추출물, 알로에베라잎즙, 적색227호/3단계:정제수, 글리세린, 프로판디올, 소듐하이알루로네이트, 하이드록시에칠셀룰로오스, 클로페네신, 페녹시에탄올, 피이지-60하이드로제네이티드캐스터오일, 에리스리톨, 트레할로스, 카프릴릴글라이콜, 향료,리날룰 1,2-헥산디올, 디소듐이디티에이, 디포타슘글리시리제이트, 팔각회향추출물, 녹차추출물, 캐모마일꽃추출물, 사과추출물, 라임추출물, 자몽추출물, 하이드롤라이즈드콜라겐추출물",피기맘 쏙쏙 코팩,"4,000원",스킨케어
661,아크네스,https://contents.lotteon.com/itemimage/LB/PD/10/01/63/70/_2/53/69/LBPD10016370_25369_1.jpg/dims/resizef/554X554,"정제수, 메틸프로판다이올, 글리세린, 나이아신아마이드, 비피다발효용해물, 폴리메틸실세스퀴옥세인, 1,2-헥산다이올, 세틸에틸헥사노에이트, 폴리글리세린-3, 판테놀, 병풀추출물, 무화과추출물, 귀리커넬추출물, 봉의꼬리추출물, 아티초크잎추출물, 티트리잎추출물, 약모밀추출물, 달맞이꽃추출물, 당느릅나무뿌리추출물, 대왕송잎추출물, 칡뿌리추출물, 에난티아 클로란타껍질추출물, 녹차수, 하이드로제네이티드레시틴, 소듐하이알루로네이트, 사이클로헥사실록세인, 암모늄아크릴로일다이메틸타우레이트/브이피코폴리머, 부틸렌글라이콜, 잔탄검, 카보머, 아데노신, 다이소듐이디티에이, 트로메타민, 폴리쿼터늄-51, 베타-글루칸, 세라마이드엔피, 솔비탄라우레이트, 글루코노락톤, 팔미토일펜타펩타이드-4, 하이드록시에틸셀룰로오스, 아세틸다이펩타이드-1세틸에스터, 올레아놀릭애씨드, 에틸헥실글리세린, 펜틸렌글라이콜, 카프릴릴글라이콜",포어 타이트닝 세럼 30ml,"15,600원",스킨케어
662,토니모리,https://contents.lotteon.com/itemimage/LB/PD/10/02/16/12/_3/26/17/LBPD10021612_32617_1.jpg/dims/resizef/554X554,"녹차추출물(63%), 정제수, 다이프로필렌글라이콜, 프로판다이올, C9-12알케인, 피피지-14부틸에터, 하이드로제네이티드에틸헥실올리베이트, 아라키딜알코올, 1,2-헥산다이올, 폴리메틸실세스퀴옥세인, 폴리글리세릴-2스테아레이트, 베헤닐알코올, 암모늄아크릴로일다이메틸타우레이트/브이피코폴리머, 글리세릴스테아레이트, 아라키딜글루코사이드, 스테아릴알코올, 다이메티콘/비닐다이메티콘크로스폴리머, 아크릴레이트/C10-30알킬아크릴레이트크로스폴리머, 다이메티콘올, 트라이실록세인, 알란토인, 하이드록시에틸아크릴레이트/소듐아크릴로일다이메틸타우레이트코폴리머, 베르가모트오일, 클레리오일, 오렌지껍질오일, 트로메타민, 잔탄검, 하이드로제네이티드올리브오일불검화물, 다이소듐이디티에이, 에칠아스코빌에텔",더촉촉 그린티 수분 크림 60ml,"10,850원",스킨케어
663,나이팅게일,https://contents.lotteon.com/itemimage/LB/PD/10/00/88/50/_1/39/39/LBPD10008850_13939_1.jpg/dims/resizef/554X554,"1STEP_정제수, 부틸렌글라이콜, 글리세린, 트레할로스, 프로판디올, 글라이콜릭애씨드, 피이지-75, 1,2-헥산디올, 알지닌, 하이드롤라이즈드콜라겐, 피이지-60하이드로제네이티드캐스터오일, 잔탄검, 클로페네신, 윈터그린잎추출물, 왕귤나무씨추출물, 창포추출물, 흰목이버섯추출물, 디소듐이디티에이, 향료, 아데노신, 해수,쟈스민꽃수, 포도주추출물, 대나무수, 자작나무수액, 다마스크장미꽃수, 타우린, 들깨잎추출물, 바닐릴부틸에텔, 녹차추출물, 페녹시에탄올, 에칠헥실글리세린 2STEP_피브이피, 정제수, 글리세린, 피이지-12디메치콘, 카올린, 티타늄디옥사이드, 브이피/브이에이코폴리머, 부틸렌글라이콜, 페녹시에탄올, 하이드롤라이즈드콜라겐, 포도주추출물, 녹차추출물, 자작나무수액, 해수, 대나무수, 쟈스민꽃수, 다마스크장미꽃수, 타우린 3STEP_정제수, 글리세린, 부틸렌글라이콜, 프로판디올, 하이드롤라이즈드호호바에스터, 12-헥산디올, 하이드롤라이즈드콜라겐, 피이지-60하이드로제네이티드캐스터오일, 판테놀, 카보머, 잔탄검, 클로페네신, 알지닌, 펜틸렌글라이콜, 나무씨추출물,디포타슘글리시리제이트, 창, 추출물, 디소듐이디티에이, 향료, 해수, 아데노신, 병풀추출물, 글리세릴아크릴레이트/아크릴릭애씨드코폴리머, 쟈스민꽃수, 서양장미꽃수, 포도주추출물, 대나무수, 자작나무수액, 다마스크장미꽃수, 위치하젤잎추출물, 프로필렌글라이콜, 피브이엠/엠에이코폴리머, 타우린, 알로에베라잎추출물, 들깨잎추출물, 서양장미꽃추출물, 녹차추출물, 페녹시에탄올, 대왕송잎추출물, 느릅나무뿌리추출물, 달맞이꽃추출물, 갈근추출물,에칠헥실글리세린",3스텝 타코팩 [문어흡착팩],"12,000원",스킨케어
664,라포티셀,https://contents.lotteon.com/itemimage/LB/PD/10/01/88/52/_2/89/14/LBPD10018852_28914_1.jpg/dims/resizef/554X554,"돌콩오일,에틸헥실팔미테이트,피이지-20글리세릴트라이아이소스테아레이트,마카다미아씨오일,아보카도오일,올리브오일,브라질넛씨오일,살구씨오일,잇꽃씨오일,레몬껍질오일,에틸헥실글리세린",올바른  클렌징 생활 오일 300ml 1+1 기획,"21,700원",스킨케어
665,파파레서피,https://contents.lotteon.com/itemimage/LB/PD/10/02/28/80/_3/43/91/LBPD10022880_34391_1.jpg/dims/resizef/554X554,"정제수, 프로판다이올, 다이프로필렌글라이콜, 메틸프로판다이올, 나이아신아마이드, 펜틸렌글라이콜, 옥틸도데세스-16, 글리세린, 베타인, 알파-비사보롤, 하이드록시아세토페논, 아크릴레이트/C10-30알킬아크릴레이트크로스폴리머, 트로메타민, 에틸헥실글리세린, 다시마추출물, 한련초잎추출물, 다이소듐이디티에이, 귀리커넬추출물, 아티초크잎추출물, 폴리쿼터늄-51, 하이드로제네이티드레시틴, 베타-글루칸, 녹차수, 1,2-헥산다이올, 인도멀구슬나무꽃추출물, 프룩토올리고사카라이드, 인도멀구슬나무잎추출물, 부틸렌글라이콜, 홀리바질잎추출물, 울금뿌리추출물, 당근추출물(10ppm), 하이드롤라이즈드하이알루로닉애씨드, 참산호말추출물, 사이아노코발아민, 글루타티온, 토코페롤, 아세틸글루코사민, 닥나무뿌리추출물, 뽕나무껍질추출물, 사과추출물, 동백나무잎추출물, 녹차추출물, 병풀추출물, 갈락토아라비난, 송이버섯추출물",캐롯 솔루션 스킨 200ml,"19,900원",스킨케어
666,토피크렘,https://contents.lotteon.com/itemimage/LB/PD/10/01/72/14/_2/64/15/LBPD10017214_26415_1.jpg/dims/resizef/554X554,"라이트 UM 크림 : 정제수, 미네랄오일, 아이소프로필아이소스테아레이트, 글리세린, 옥틸도데실피씨에이, 글리세릴스테아레이트, 피이지-100스테아레이트, 우레아, 잔탄검, 페녹시에탄올, 바이오사카라이드검-1, 에틸헥실글리세린, 소듐폴리아크릴레이트, 토코페롤, 클로페네신, 소듐하이드록사이드, 향료",모이스처 라이징 라이트 크림 40ml,"7,900원",스킨케어
667,바이오더마,https://contents.lotteon.com/itemimage/LB/PD/10/01/69/12/_2/60/37/LBPD10016912_26037_1.jpg/dims/resizef/554X554,"정제수, 피이지-6카프릴릭/카프릭글리세라이즈, 다이소듐이디티에이, 세트리모늄브로마이드, 프로필렌글라이콜, 오이열매추출물, 프룩토올리고사카라이드, 만니톨, 자일리톨, 람노오스",센시비오 H2O 500ml 펌프형 500ml,"17,500원",스킨케어
668,비페스타,https://contents.lotteon.com/itemimage/LB/PD/10/00/93/27/_1/47/22/LBPD10009327_14722_1.jpg/dims/resizef/554X554,"정제수, 에탄올, 글리세린, 피피지-75-피이지-300핵실렌글라이콜, 피이지-7글리세릴코코에이트, 피이지-6카프릴릭/카프릭글리세라이드, 피이지-20글리세릴디이소스테아레이트, 페녹시에탄올,메칠파라벤, 소듐스테아로일글루타메이트, 소듐시트레이트, 디소듐이디티에이, 시트릭애씨드, 디하이드록시프로필알지닌에이치씨엘, 피이지-6, 피이지-32",클렌징시트 모이스트 46매,"10,000원",스킨케어
669,센텔리안24,https://contents.lotteon.com/itemimage/LB/PD/10/01/86/87/_2/86/50/LBPD10018687_28650_1.jpg/dims/resizef/554X554,"병풀추출물, 사이클로헥사실록세인, 나이아신아마이드, 다이카프릴릴에터, 1,2-헥산다이올, C14-22알코올, 다이프로필렌글라이콜, 다시마추출물, 한련초잎추출물, 무화과추출물, 베르가못잎추출물, 피버퓨추출물, 살비아잎수, 수용성콜라겐, 오렌지껍질오일, 하이드로제네이티드레시틴, 올리브오일, 병풀오일, 폴리글리세릴-10라우레이트, 소듐아크릴레이트/소듐아크릴로일다이메틸타우레이트코폴리머, 정제수, 다이메티콘/비닐다이메티콘크로스폴리머, 폴리아이소부텐, C12-20알킬글루코사이드, 글리세릴스테아레이트에스이, 아크릴레이트/C10-30알킬아크릴레이트크로스폴리머, 트로메타민, 베타-글루칸, 솔비탄올리에이트, 카프릴릴/카프릴글루코사이드, 아데노신, 프룩토올리고사카라이드, 소듐스테아로일글루타메이트, 다이소듐이디티에이, 글리세린, 소듐라우레이트, 알란토인, 하이드롤라이즈드하이알루로닉애씨드, 라우릭애씨드, 마데카식애씨드, 아시아티코사이드, 글루코오스, 아시아틱애씨드, 세라마이드엔피, 수용성프로테오글리칸, 엘라스틴, 포스포리피드, 하이알루로닉애씨드, 폴리솔베이트60, 에틸헥실글리세린, 리모넨","마데카 릴리프 크림 기획 (+토너,에센스,마스크팩)","20,800원",스킨케어
670,바이오더마,https://contents.lotteon.com/itemimage/LB/PD/10/00/02/01/_2/28/LBPD10000201_228_1.jpg/dims/resizef/554X554,"정제수, 피이지-6카프릴릭/카프릭글리세라이드, 소듐시트레이트, 시트릭애씨드, 디소듐이디티에이, 징크글루코네이트, 세트리모늄브로마이드, 카퍼설페이트, 프룩토올리고사카라이드, 만니톨, 람노오스, 자일리톨, 프로필렌글라이콜, 은행잎추출물, 향료",세비엄 H2O 500ml,"24,000원",스킨케어
671,메디큐브,https://contents.lotteon.com/itemimage/LB/PD/10/00/33/68/_5/78/0/LBPD10003368_5780_1.jpg/dims/resizef/554X554,추후 전달 예정,레드 토너 100ml,"25,600원",스킨케어
672,레드투래드,https://contents.lotteon.com/itemimage/LB/PD/10/01/78/38/_2/73/38/LBPD10017838_27338_1.jpg/dims/resizef/554X554,"에틸헥실팔미테이트, 세틸에틸헥사노에이트, 솔베스-30테트라올리에이트, 잇꽃씨오일, 아이소프로필미리스테이트, C13-15알케인, 정제수, 피뿌리풀잎/줄기추출물, 해바라기씨오일, 돌콩추출물, 토코페롤, 글리세린, 펜틸렌글라이콜, 부틸렌글라이콜, 1,2-헥산다이올, 옥탄다이올, 에틸헥실글리세린, 향료",안티더스트 클렌징 오일 150ml,"16,600원",스킨케어
673,제이엠솔루션,https://contents.lotteon.com/itemimage/LB/PD/10/02/06/62/_3/13/90/LBPD10020662_31390_1.jpg/dims/resizef/554X554,"편백수, 글리세린, 부틸렌글라이콜, 다이프로필렌글라이콜, 비닐다이메티콘, C14-22알코올, 프로판다이올, 1,2-헥산다이올, 하이드로제네이티드폴리데센, 펜틸렌글라이콜, 카프릴릴메티콘, C12-20알킬글루코사이드, 카보머, 세틸에틸헥사노에이트, 트로메타민, 세테아릴알코올, 정제수, 글리세릴아크릴레이트/아크릴릭애씨드코폴리머, 만주자작나무수액, 에틸헥실글리세린, 다이소듐이디티에이, 하이알루로닉애씨드, 하이드롤라이즈드하이알루로닉애씨드, 소듐하이알루로네이트, 베르가모트오일, 글루코오스, 로즈마리잎오일, 크랜베리추출물, 서양산딸기추출물, 카프릴릴글라이콜, 연꽃수, 로즈우드오일",글로우 필 스파 크림 기획 (+크림),"23,600원",스킨케어
674,GD11,https://contents.lotteon.com/itemimage/LB/PD/10/01/63/04/_2/52/75/LBPD10016304_25275_1.jpg/dims/resizef/554X554,"[지디일레븐 셀팩토리 파워 글로우 볼] 소듐하이알루로네이트, 하이드록시프로필메틸셀룰로오스, 올리브오일피이지-7에스터, 비닐다이메티콘/메티콘실세스퀴옥세인크로스폴리머, 마그네슘아스코빌포스페이트, 인체제대혈세포배양액, 만니톨, 다이프로필렌글라이콜, 1,2-헥산다이올, 비타민나무열매추출물, 카퍼트라이펩타이드-1, 트라이펩타이드-1, 팔미토일펜타펩타이드-4, 다이펩타이드-2, 올리고펩타이드-1, 에델바이스캘러스배양추출물 (인체제대혈세포배양액 5,000 ppm 함유)    [지디일레븐 셀팩토리 파워 글로우 부스터] 정제수, 부틸렌글라이콜, 글리세린, 글리세레스-26, 프로판다이올, 나이아신아마이드, 1,2-헥산다이올, C12-14파레스-7, 판테놀, 암모늄아크릴로일다이메틸타우레이트/브이피코폴리머, 황련추출물, 잔탄검, 에틸헥실글리세린, 아데노신, 한련초추출물, 아이비고드열매추출물, 다이소듐이디티에이, 하이드로제네이티드레시틴, 폴리글리세릴-10스테아레이트, 소듐아스코빌포스페이트, 로즈힙열매추출물, 비타민나무열매추출물, 인도멀구슬나무꽃추출물, 하이드록시프로필사이클로덱스트린, 홀리바질잎추출물, 카카두플럼추출물, 인도멀구슬나무잎추출물, 울금뿌리추출물, 참산호말추출물, 까무까무열매추출물, 글루타티온, 피리독신, 폴릭애씨드, 바이오틴, 토코페롤, 사이아노코발아민, 티아민에이치씨엘, 리보플라빈, 리놀레익애씨드, 이노시톨, 베타-카로틴, 향료",셀팩토리 파워 글로우 스타터 (1회분),"3,000원",스킨케어
675,유리아쥬,https://contents.lotteon.com/itemimage/LB/PD/10/00/29/50/_5/04/4/LBPD10002950_5044_1.jpg/dims/resizef/554X554,"정제수,부티로스퍼뭄파르키(쉐어버터),디메치콘,스쿠알란,하이드로제네이티드폴리데센,글리세린,디글리세린,에틸헥실팔미테이트,메도우폼씨오일,폴리메칠메타크릴레이트,프로판다이올,프로필헵틸카프릴레이트,부틸렌글라이콜,자일리틸글루코사이드,1,2-헥산다이올,스테아레스-2,스테아레스-21,안하이드로자일리톨,세틸알코올,트레할로스,우레아,자일리톨,아크릴레이트/C10-30알킬아크릴레이트크로스폴리머,클로페네신,펜타에리스리틸디스테아레이트,소듐폴리아크릴레이트,향료,글루코오스,o-사이멘-5-올,토코페릴아세테이트,펜틸렌글라이콜,세린,소듐하이드록사이드,알진,카프릴릴글라이콜,다이소듐포스페이트,글리세릴폴리아크릴레이트,풀루란,소듐하이알루로네이트,포타슘포스페이트",오 떼르말 워터 크림 40ml,"28,000원",스킨케어
676,파파레서피,https://contents.lotteon.com/itemimage/LB/PD/10/02/28/78/_3/43/88/LBPD10022878_34388_1.jpg/dims/resizef/554X554,"정제수, 메틸프로판다이올, 1,2-헥산다이올, 프로판다이올, 부틸렌글라이콜, 나이아신아마이드, 당근추출물(8,714ppm), 옥틸도데세스-16, 다이프로필렌글라이콜, 글리세린, 한련초잎추출물, 다시마추출물, 아크릴레이트/C10-30알킬아크릴레이트크로스폴리머, 잔탄검, 에틸헥실글리세린, 트로메타민, 아데노신, 다이소듐이디티에이, 불가리스쑥오일, 프룩토올리고사카라이드, 소듐하이알루로네이트, 인도멀구슬나무꽃추출물, 하이드로제네이티드레시틴, 베타-글루칸, 인도멀구슬나무잎추출물, 홀리바질잎추출물, 울금뿌리추출물, 하이드롤라이즈드하이알루로닉애씨드, 참산호말추출물, 사이아노코발아민, 토코페롤, 붉은토끼풀추출물, 단삼뿌리추출물, 아세틸글루코사민, 알파-비사보롤, 닥나무뿌리추출물, 뽕나무껍질추출물, 사과추출물, 동백나무잎추출물, 녹차추출물, 병풀추출물, 갈락토아라비난, 글루타티온, 송이버섯추출물",캐롯 다크스팟 솔루션 앰플 30ml,"19,900원",스킨케어
677,엘리자베스아덴,https://contents.lotteon.com/itemimage/LB/PD/10/01/98/31/_3/02/16/LBPD10019831_30216_1.jpg/dims/resizef/554X554,"페트롤라툼,라놀린,미네랄오일, 피마자오일,살리실릭애씨드,토코페릴아세테이트,그린와틀추출물,통카콩열매추출물,바닐린,벤질알코올,옥수수오일,토코페롤,식물성오일,비에이치티,적색산화철,황색산화철",에잇아워크림 라이트리센티드 50ml(무향) [업체배송],"22,500원",스킨케어
678,피지오겔,https://contents.lotteon.com/itemimage/LB/PD/10/01/88/17/_2/88/80/LBPD10018817_28880_1.jpg/dims/resizef/554X554,"정제수, 카프릴릭/카프릭트리글리세라이드, 글리세린, 펜틸렌글라이콜, 쉐어버 터, 하이드로제네이티드레시틴, 팔미타마이드엠이에이, 하이드록시에칠셀룰로 오스, 카프릴릴글라이콜, 잔탄검, 베타인, 스쿠알란, 사코신, 아세트아마이드엠 이에이, 소듐카보머, 카보머, 세라마이드엔피(세라마이드3)",레드수딩 AI 로션 200ml,"28,000원",스킨케어
679,라포티셀,https://contents.lotteon.com/itemimage/LB/PD/10/01/88/35/_2/89/17/LBPD10018835_28917_1.jpg/dims/resizef/554X554,"정제수, 글리세린, 부틸렌글라이콜, 하이드로제네이티드폴리데센, 나이아신아마이드, 프로판다이올, 하이드록시에틸아크릴레이트/소듐아크릴로일다이메틸타우레이트코폴리머, 페닐트라이메티콘, 1,2-헥산다이올, 카프릴릴글라이콜, 암모늄아크릴로일다이메틸타우레이트/베헤네스-25메타크라일레이트크로스폴리머, 다이메티콘/비닐다이메티콘크로스폴리머, 다이메티콘올, 트라이실록세인, 판테놀, 솔비탄아이소스테아레이트, 펜틸렌글라이콜, 잔탄검, 마데카소사이드, 목련나무껍질추출물, 다이소듐이디티에이, 녹차추출물, 애플민트잎추출물, 타임잎추출물, 글리세릴아크릴레이트/아크릴릭애씨드코폴리머, 향료",블레미쉬 아웃 크림 50ml,"13,300원",스킨케어
680,라로슈포제,https://contents.lotteon.com/itemimage/LB/PD/10/01/63/78/_2/53/79/LBPD10016378_25379_1.jpg/dims/resizef/554X554,정제수 글리세린 프로판다이올 펜틸렌글라이콜 알란토인 소듐클로라이드 카르노신 코코-베타인 시트릭애씨드,똘러리앙 울트라 8워터 에센스 100ml,"29,000원",스킨케어
681,아벤느,https://contents.lotteon.com/itemimage/LB/PD/10/02/06/15/_3/13/50/LBPD10020615_31350_1.jpg/dims/resizef/554X554,"아벤느온천수(아쿠아), 정제수, 소듐코코암포아세테이트, 다이소듐코코일글루타메이트, 시트릭애씨드, 다이소듐이디티에이, 조합향료, 글루타믹애씨드, 락틱애씨드, 프로필렌글라이콜, 소듐벤조에이트, 소듐클로라이드",젠틀 클렌징 무스 폼 150ml,"24,000원",스킨케어
682,센카,https://contents.lotteon.com/itemimage/LB/PD/10/02/14/88/_3/24/77/LBPD10021488_32477_1.jpg/dims/resizef/554X554,"정제수, 솔비톨, 글리세린, 다이프로필렌글라이콜, 부틸렌글라이콜, 소듐메틸타우레이트, 라우릴베타인, 라우릭애씨드, 알지닌코코에이트, 미리스틱애씨드, 향료, 펜타소듐펜테테이트, 폴리쿼터늄-7, 소듐벤조에이트, 포타슘하이드록사이드, 소듐메타바이설파이트, 피이지/피피지-14/7다이메틸에터, 소듐하이알루로네이트, 시트릭애씨드, 소듐아세틸레이티드하이알루로네이트, 세리신, 에탄올, 포타슘솔베이트, 하이드롤라이즈드실크",스피디 퍼펙트 휩 2입 (150ml+150ml),"19,800원",스킨케어
